{
  "schemaIdentifier": "wave-vortex-run-request-v2",
  "schemaVersion": 2,
  "modelFiles": ["../forcing-nonlinear.nc"],
  "integration": {
    "method": "adaptive-rk78",
    "finalTime": 12,
    "initialStep": 0.25,
    "maximumStep": 1,
    "relativeTolerance": 0.001,
    "absoluteToleranceScale": 0.000001
  },
  "output": {"policy": "append", "destinations": {}},
  "execution": {"fftProvider": "reference", "threads": 1},
  "report": "v2-adaptive-rk78-report.json"
}
